code,internal_code,name,manufacturer_name,manufacture_country,manufacturer_item_description,unit_qty,quantity,unit_of_measure,weighted,qty_in_package,price,unit_of_measure_price,allow_discount,status,item_id
7290113830967,false,לייף קידס בקבוק טריטן 500 מל-עיצובי מטוס,שמחה זה אנחנו,CN,KIDS בקבוק טריטן - עיצובי מטוסים,,0.00,0.00,false,1.00,26.90,0.00,true,0,
7290113840027,false,לייף דאו ספריי לבנדר מרווה לנשים,לייף,IL,דאודורנט ספריי לבנדר מרווה לנשים,,0.00,100.00,false,1.00,9.90,0.00,true,0,
7290113840034,false,לייף דאו ספריי ילנג ילנג קלנדולה לנשים,לייף,IL,דאודורנט ספריי ילנג ילנג קלנדולה לנשים,,0.00,100.00,false,1.00,9.90,0.00,true,0,
7290113840041,false,לייף דאו ספריי ללא אלומיניום אלוורה לנשי,לייף,IL,דאודורנט ספריי ללא אלומיניום אלוורה לנשים,,0.00,100.00,false,1.00,9.90,0.00,true,0,
7290113840065,false,לייף דאודורנט ספריי COOL ENERGY לגבר,לייף,,דאודורנט ספריי COOL ENERGY לגבר,,0.00,100.00,false,1.00,9.90,0.00,true,0,
7290113840072,false,לייף דאודורנט ספריי DARK ENERGY לגבר,לייף,,דאודורנט ספריי DARK ENERGY לגבר,,0.00,100.00,false,1.00,9.90,0.00,true,0,
7290113840294,false,לייף מדבקות אף בשני שלבים,זר הייטק,KR,מדבקות לניקוי והרגעת נקבוביות העור,,0.00,0.00,false,1.00,29.90,0.00,true,0,
7290113840379,false,לייף דאו רול און לגבר FRESH ENERGY,סאסא-טק,IL,דאודורנט רול און לגבר FRESH ENERGY,,0.00,100.00,false,1.00,9.90,0.00,true,0,
7290113840386,false,לייף דאו רול און לגבר LIGHT ENERGY,סאסא-טק,IL,דאודורנט רול און לגבר LIGHT ENERGY,,0.00,100.00,false,1.00,9.90,0.00,true,0,
7290113840461,false,לייף קליפס עם טבליית שמנים TO GO,PROSEEKERS LIFE,CN,קליפס עם טבליית שמנים ארומטיים מחומרים טבעיים בלבד TO GO,,0.00,0.00,false,1.00,24.90,0.00,true,0,
7290113840614,false,לייף סינרים חד-פעמיים 20 יחידות,איתן,,סינרים חד פעמיים לתינוק,,0.00,0.00,false,1.00,24.90,1.24,true,0,
7290113840638,false,ביו פלסטיק זוג מברשות שיניים,טריזה,CH,מברשות שיניים אקולוגיות ביו פלסטיק,,0.00,0.00,false,1.00,21.90,0.00,true,0,
7290113840652,false,לייף וולנס חטיף בוטנים שקדים תפוח דבש*5,ספץ תעשיות,IL,חטיף שקדים תפוח צימוקים בוטנים דבש וקינמון,,0.00,0.00,false,1.00,13.90,0.00,true,0,
7290113840669,false,לייף וולנס חטיף בוטנים שקדים צימוקים*5,ספץ תעשיות,IL,חטיף שקדים גרעיני דלעת צימוקים ודבש,,0.00,0.00,false,1.00,13.90,0.00,true,0,
7290113840768,false,לייף מארז 5 טישו במבו בתוספת לחות 40 יח,לייף,CN,במבו טישו בתוספת לחות,,0.00,0.00,false,1.00,14.90,2.98,true,0,
7290113840867,false,לייף תחליב באלם 150 מל,שיק תעשיות תמרוקים,,MEN תחליב לחות מבושם לאחר הגילוח,,0.00,100.00,false,1.00,18.90,0.00,true,0,
7290113840980,false,סאנדיי נוזל לניקוי וחיטוי פירות וירקות,איתן,IL,נוזל אקולוגי לניקוי וחיטוי פירות וירקות,,0.00,100.00,false,1.00,18.90,0.00,true,0,
7290113850026,false,לייף מי פה לילדים תות גילאי 6+ 250 מל,ח.נ.ה,ES,מי פה לילדים תות גילאי 6+,,0.00,100.00,false,1.00,13.90,0.00,true,0,
7290113850088,false,לייף וולנס גרנולה שוקולד מריר חמוציות400,אפקטבעי,IL,גרנולה עם שוקולד מריר וחמוציות,,0.00,100.00,false,1.00,14.90,0.00,true,0,
7290113850095,false,לייף וולנס גרנולה חלווה וקשיו 400 גרם,אפקטבעי,IL,גרנולה עם חלווה ואגוזי קשיו,,0.00,100.00,false,1.00,14.90,0.00,true,0,
7290113850118,false,לייף וולנס חטיף גרנולה קראנץ חלבה שישייה,אפקטבעי,IL,חטיף גרנולה קראנצ' עם דגנים מלאים וחלבה,,0.00,0.00,false,1.00,13.90,0.00,true,0,
7290113850125,false,לייף וולנס חטיף גרנולה קראנץ שוקולד שישי,אפקטבעי,IL,קראנצ' חטיפי גרנולה דגנים ונטיפי שוקולד מריר,,0.00,0.00,false,1.00,13.90,0.00,true,0,
7290113850132,false,לייף קידס חיתולי לילה 10 יחידות M,ONTEX,,תחתונים להרטבת לילה לילדים בוגרים M,,0.00,0.00,false,1.00,29.90,2.99,true,0,
7290113850149,false,לייף קידס חיתולי לילה 9 יחידות L,ONTEX,BE,תחתונים להרטבת לילה לילדים בוגרים L,,0.00,0.00,false,1.00,29.90,3.32,true,0,
7290113850170,false,לייף טישו קוביה 56 יח סימבה טרופי ירוק,לייף,IL,ממחטות נייר רכות במיוחד תלת-שכבתיות סימבה טרופי ירוק,,0.00,0.00,false,1.00,6.90,0.12,true,0,
7290113850187,false,לייף טישו קוביה 56 יח סימבה מנומר WILD,לייף,IL,ממחטות נייר רכות במיוחד תלת-שכבתיות סימבה מנומר WILD,,0.00,0.00,false,1.00,6.90,0.12,true,0,
7290113850194,false,לייף מסכות פנים - מארז 10 יח- צבע לבן,לייף,,מסכות פנים הגייניות,,0.00,0.00,false,1.00,7.90,0.79,true,0,
7290113850200,false,לייף מסכות פנים - מארז 50 יח- צבע כחול,לייף,,מסכות פנים הגייניות,,0.00,0.00,false,1.00,12.90,0.25,true,0,
7290113850231,false,פצצת אמבטיה- ירוק  צבע אחד מנויילנת 160,לייף,CN,פצצת אמבט בניחוח פאפיה ומלון,,0.00,100.00,false,1.00,12.90,0.00,true,0,
7290113850248,false,פצצת אמבטיה- סגול  צבע אחד מנויילנת 160,לייף,CN,פצצת אמבט בניחוח לבנדר,,0.00,100.00,false,1.00,12.90,0.00,true,0,
7290113850255,false,פצצת אמבטיה- ורוד  צבע אחד מנויילנת 160,לייף,CN,פצצת אמבט בניחוח פירות יער,,0.00,100.00,false,1.00,12.90,0.00,true,0,
7290113850262,false,פצצת אמבטיה - כתום צבע אחד מנויילנת 160,לייף,CN,פצצת אמבט בניחוח פירות הדרים,,0.00,100.00,false,1.00,12.90,0.00,true,0,
7290113850675,false,לייף וולנס זעתר טבעי 100 גרם,לייף,IL,זעתר טבעי,,0.00,0.00,false,1.00,9.90,0.09,true,0,
7290113850699,false,לייף גל אלכוהול 70% כדורגל 30 מל,אמיליה קוסמטיקס,IL,ג'ל אלכוהול 70% כדורגל באריזת סיליקון נתלה על התיק,,0.00,100.00,false,1.00,6.90,0.00,true,0,
7290113850774,false,לייף סט 3 בגד גוף אפור 0-3 קיץ 21,מיננה,CN,סט בגד גוף אפור 0-3 קיץ 21,,0.00,0.00,false,1.00,59.90,19.96,true,0,
7290113850859,false,לייף סט 3 מכנסיים אפור 6-12 קיץ 21,מיננה,CN,סט מכנסיים אפור 6-12 קיץ 21,,0.00,0.00,false,1.00,42.90,14.30,true,0,
7290113850873,false,לייף סט 3 מכנסיים ורוד 3-6 קיץ 21,מיננה,CN,סט מכנסיים ורוד 3-6 קיץ 21,,0.00,0.00,false,1.00,42.90,14.30,true,0,
7290113860148,false,לייף פרימיום חיתולים מיני 2 24 יחידות,General,CN,חיתולים פרימיום מיני מידה 2,,0.00,0.00,false,1.00,19.90,0.82,true,0,
7290113860155,false,לייף פרימיום חיתולים מידי 3 23 יחידות,ONTEX,CN,חיתולים פרימיום מידי מידה 3,,0.00,0.00,false,1.00,19.90,0.86,true,0,
7290113860162,false,לייף פרימיום חיתולים מקסי 4 21 יחידות,ONTEX,CN,חיתולים פרימיום מקסי מידה 4,,0.00,0.00,false,1.00,19.90,0.94,true,0,
7290113860179,false,לייף פרימיום חיתולים גוניור 5 21 יחידות,ONTEX,CN,חיתולים פרימיום ג'וניור מידה 5,,0.00,0.00,false,1.00,19.90,0.94,true,0,
7290113860285,false,סו.קו כיסוי עיניים,General,CN,כיסוי עיניים,,0.00,0.00,false,1.00,24.90,0.00,true,0,
7290113860308,false,לייף וולנס שקדים קלויים 50 גרם,לייף,GR,שקדים קלויים מומלחים TO GO,,0.00,100.00,false,1.00,6.90,0.00,true,0,
7290113860315,false,לייף וולנס אגוזים קלויים וגרגירי חומוס50,לייף,GR,"TO GO תערובת שקדים, גרגירי חומוס, בוטנים ואגוזי קשיו קלויים",,0.00,100.00,false,1.00,5.90,0.00,true,0,
7290113860322,false,וולנס חטיף דגנים עם תפוח עץ וחמוציות שיש,ספץ תעשיות,MK,חטיף דגנים עם תפוח עץ וחמוציות,,0.00,0.00,false,1.00,13.90,2.31,true,0,
7290113860339,false,וולנס גרנולה קראנצ טו גו עם תפוח צימוק ו,ספץ תעשיות,IL,גרנולה קראנצ טו גו עם תפוח צימוק ואגוז לוז,,0.00,100.00,false,1.00,6.90,0.00,true,0,
7290113860346,false,לייף קידס LOL אלסבון 700 מל,ארמן,IL,אל סבון לגוףLOL,,0.00,100.00,false,1.00,13.90,0.00,true,0,
7290113860353,false,לייף קידס LOL מרכך לסירוק קל 700 מל,ארמן,IL,מרכך לסירוק קל LOL,,0.00,100.00,false,1.00,13.90,0.00,true,0,
7290113860360,false,לייף קידס LOL שמפו לסירוק קל 700 מל,ארמן,IL,שמפו לסירוק קל LOL,,0.00,100.00,false,1.00,13.90,0.00,true,0,
7290113860391,false,לייף קידס חטיף ממולא בקרם שקדים ובטעם תפ,לייף,IL,חטיף ממולא בקרם שקדים ובטעם תפוח,,0.00,100.00,false,1.00,4.90,0.00,true,0,
7290113860407,false,לייף קידס חטיף ממולא בקרם שקדים ובטעם בנ,לייף,IL,חטיף ממולא בקרם שקדים ובטעם בננה,,0.00,100.00,false,1.00,4.90,0.00,true,0,
7290113860605,false,לייף וולנס חטיף דגנים מלאים במילוי שוקול,General,IL,חטיף דגנים מלאים בציפוי חמאת בוטנים ובמילוי קרם בטעם שוקולד,,0.00,100.00,false,1.00,3.90,0.00,true,0,
7290113860612,false,לייף בייביז שמפו להזנת העור 1 ליטר,לייף,IL,שמפו לעור רגיש להזנת העור,,0.00,1.00,false,1.00,19.90,19.90,true,0,
7290113860629,false,לייף בייביז אלסבון להזנת העור 1 ליטר,לייף,IL,אל-סבון לעור רגיש,,0.00,1.00,false,1.00,19.90,19.90,true,0,
7290113860636,false,לייף בייביז שמפו ואלסבון להזנת העור 1 לי,לייף,IL,שמפו ואלסבון לעור רגיש להזנת העור,,0.00,1.00,false,1.00,19.90,19.90,true,0,
7290113860643,false,לייף בייביז שמפו להזנת העור 750 מל,לייף,IL,שמפו אל-דמע להזנת העור,,0.00,100.00,false,1.00,16.90,0.00,true,0,
7290113860650,false,לייף בייביז תחליב רחצה להזנת העור 750 מל,לייף,IL,תחליב רחצה מועשר בלחות,,0.00,100.00,false,1.00,16.90,0.00,true,0,
7290113860667,false,לייף בייביז תחליב גוף להזנת העור 400 מל,לייף,IL,תחליב גוף לעור רגיש,,0.00,100.00,false,1.00,22.90,0.00,true,0,
7290113860674,false,לייף בייביז שמפו להרגעת העור 1 ליטר,לייף,IL,שמפו להרגעת העור,,0.00,1.00,false,1.00,19.90,19.90,true,0,
7290113860681,false,לייף בייביז אלסבון להרגעת העור 1 ליטר,לייף,IL,אל-סבון לעור רגיש,,0.00,1.00,false,1.00,19.90,19.90,true,0,
7290113860698,false,לייף בייביז שמפו וסבון יחדיו להרגעת העור,לייף,IL,שמפו וסבון יחדיו להרגעת העור,,0.00,1.00,false,1.00,19.90,19.90,true,0,
7290113860704,false,לייף בייביז אלסבון להרגעת העור 750 מל,לייף,IL,אל סבון לפני השינה,,0.00,100.00,false,1.00,16.90,0.00,true,0,
7290113860711,false,לייף בייביז שמפו אל-דמע להרגעת העור 750,לייף,IL,שמפו אל-דמע להרגעת העור מועשר בצמחים,,0.00,100.00,false,1.00,16.90,0.00,true,0,
7290113860728,false,לייף בייביז תחליב רחצה להרגעת העור 750,לייף,IL,תחליב רחצה מועשר בלחות,,0.00,100.00,false,1.00,16.90,0.00,true,0,
7290113860742,false,לייף דאודורנט סטיק לגבר RELAXED,אמיליה קוסמטיקס,IL,דאודורנט סטיק לגבר RELAXED,,0.00,100.00,false,1.00,9.90,0.00,true,0,
7290113860766,false,לייף סינרים חד-פעמיים מיקי מאוס 20 יחידו,לייף,CN,סינרים חד-פעמיים מיקי מאוס,,0.00,0.00,false,1.00,26.90,1.34,true,0,
7290113860797,false,לייף וולנס חטיף דגנים במילוי חלבה,General,IL,חטיף דגנים מלאים בציפוי חמאת בוטנים ובמילוי קרם בטעם חלבה,,0.00,0.00,false,1.00,2.90,0.00,true,0,
7290113860803,false,וולנס חטיף שבולת שועל חמוציות וגר.דלעת*4,ספץ תעשיות,MK,"חטיף שיבולת שועל, חמוציות וגרעיני דלעת",,0.00,0.00,false,1.00,11.90,2.97,true,0,
7290113860810,false,וולנס חטיף שבולת שועל ושוקולד *4,ספץ תעשיות,MK,חטיף שיבולת שועל ושוקולד,,0.00,0.00,false,1.00,11.90,2.97,true,0,
7290113860827,false,וולנס חטיף שבולת שועל בננה ותמר *4,ספץ תעשיות,IL,"חטיף שיבולת שועל, בננה ותמר",,0.00,0.00,false,1.00,11.90,2.97,true,0,
7290113860834,false,לייף וולנס חטיף דגנים מלאים במילוי ק.שקד,General,IL,חטיף דגנים מלאים בציפוי חמאת בוטנים ובמילוי קרם שקדים,,0.00,100.00,false,1.00,3.90,0.00,true,0,
7290113860889,false,לייף וולנס עוגיות מלוחות עם שמן זית 80 ג,לייף,IL,עוגיות מלוחות עם שמן זית,,0.00,100.00,false,1.00,4.90,0.00,true,0,
7290113870260,false,סאנדיי נייר אפייה חום אקולוגי מתכלה 50יח,לייף,PL,נייר אפייה חום אקולוגי 100% מתכלה,,0.00,0.00,false,1.00,11.90,0.23,true,0,
7290113870291,false,לייף וולנס אגוזי מלך קלופים חצויים 50 גר,לייף,MK,אגוזי מלך קלופים חצויים,,0.00,100.00,false,1.00,5.90,0.00,true,0,
7290113870314,false,לייף גל אלוורה שפופרת 200 מל,סאסא-טק,IL,ג'ל אלוורה להרגעת העור אחרי שיזוף,,0.00,100.00,false,1.00,17.90,0.00,true,0,
7290113870345,false,לייף מ.הגנה 50 200 מל ספריי שקוף ללא אוק,סאסא-טק,,ספריי שקוף לעור רגיש 50SPF,,0.00,100.00,false,1.00,39.90,0.00,true,0,
7290113870352,false,לייף מ.הגנה 50 200 מל ספריי שקוף לילדים,General,,ספריי שקוף לילדים לעור רגיש SPF50,,0.00,100.00,false,1.00,39.90,0.00,true,0,
7290113870369,false,לייף מ.הגנה שמן גזר ספריי 200 מל,אמיליה קוסמטיקס,,שמן גזר 15SPF,,0.00,100.00,false,1.00,39.90,0.00,true,0,
7290113870376,false,לייף מ.הגנה 50 200 מל ספרי תחליב ללא אוק,General,,ספריי תחליבי לעור רגיש SPF50,,0.00,100.00,false,1.00,39.90,0.00,true,0,
7290113870390,false,לייף מ.הגנה 30 200 מל ספריי שקוף לעור רט,אמיליה קוסמטיקס,,ספריי שקוף לעור רטוב SPF30,,0.00,100.00,false,1.00,39.90,0.00,true,0,
7290113870406,false,לייף מ.הגנה 50 200 מל ספריי שקוף לילדים,אמיליה קוסמטיקס,,KIDS ספריי שקוף לילדים לעור רטוב,,0.00,100.00,false,1.00,39.90,0.00,true,0,
7290113870413,false,לייף מ.הגנה 50 200 מל ספריי קצף לילדים,General,,ספריי קצף לילדים לעור רגיש SPF50,,0.00,100.00,false,1.00,39.90,0.00,true,0,
7290113870437,false,לייף מארז זוג מ.הגנה 50 200 מל ספרי מבוג,General,,ספריי שקוף למבוגרים + ספריי שקוף לילדים לעור רגיש SPF50,,0.00,0.00,false,1.00,69.90,0.00,true,0,
7290113870444,false,לייף מ.הגנה 50+ מבוגר ספריי שקוף 200 מל,אמיליה קוסמטיקס,IL,ספריי שקוף לעור רגיש +SPF50,,0.00,100.00,false,1.00,44.90,0.00,true,0,
7290113870512,false,לייף וולנס פיסטוקים קלויים ללא מלח 50 גר,לייף,MK,פיסטוקים קלויים,,0.00,100.00,false,1.00,6.90,0.00,true,0,
7290113870543,false,פריכיות תפוחי אדמה וירקות 50 גרם אורגני,לייף,IT,פריכיות תפוחי אדמה וירקות אורגניים ללא גלוטן,,0.00,100.00,false,1.00,6.90,0.00,true,0,
7290113870789,false,לייף דאו רול און לגבר NATURAL ENERGY 75,סאסא-טק,IL,דאודורנט רול און לגבר NATURAL ENERGY,,0.00,100.00,false,1.00,9.90,0.00,true,0,
7290113870901,false,לייף וולנס פריכיות חומוס אורז עדשים וקינ,פרח,IL,פריכיות חומוס אורז עדשים שחורות וקינואה,,0.00,100.00,false,1.00,10.90,0.00,true,0,
7290113870918,false,פריכיות אורז מלא בתוספת קצח 100 גרם,לייף,IL,פריכיות דקות  אורז מלא וקצח,,0.00,0.00,false,1.00,6.90,0.06,true,0,
7290113870925,false,לייף גל אלוורה להרגעת העור לאחר שיזוף,אמיליה קוסמטיקס,IL,ג'ל אלוורה להרגעת העור אחרי שיזוף,,0.00,100.00,false,1.00,15.90,0.00,true,0,
7290113870932,false,לייף מ.הגנה 50 120 מל מונע צריבת מדוזות,סאסא-טק,IL,תחליב הגנה SPF50 מונע צריבת מדוזות,,0.00,100.00,false,1.00,39.90,0.00,true,0,
7290113870949,false,לייף מ.הגנה 50+ תחליב פנים לתינוקות 60 מ,אמיליה קוסמטיקס,IL,BABYS תחליב פנים לתינוקות לעור רגיש +SPF50,,0.00,100.00,false,1.00,39.90,0.00,true,0,
7290113870970,false,לייף מ.הגנה 50+ תחליב לתינוקות 125 מל,אמיליה קוסמטיקס,IL,BABYS תחליב הגנה לתינוקות לעור רגיש +SPF50,,0.00,100.00,false,1.00,39.90,0.00,true,0,
7290113870987,false,לייף מ.הגנה 50+ תחליב 150 מל,אמיליה קוסמטיקס,IL,תחליב הגנה לעור רגיש +SPF50,,0.00,100.00,false,1.00,34.90,0.00,true,0,
7290113870994,false,לייף מ.הגנה 50+ תחליב לילדים 150 מל,אמיליה קוסמטיקס,IL,KIDS תחליב הגנה לילדים לעור רגיש +SPF50,,0.00,100.00,false,1.00,34.90,0.00,true,0,
7290113880009,false,לייף מ.הגנה 50 60 מל לפנים ללא אוקסביניז,General,IL,תחליב פנים לעור רגיש SPF50,,0.00,100.00,false,1.00,24.90,0.00,true,0,
7290113880023,false,לייף מ.הגנה 50 250 מל תחליב ללא אוקסבינ,General,IL,תחליב הגנה SPF50,,0.00,100.00,false,1.00,39.90,0.00,true,0,
7290113880030,false,לייף מ.הגנה 50 60 מל גל שקוף לפנים דיילי,סאסא-טק,IL,ג'ל פנים שקוף לשימוש יומיומי במרקם קליל במיוחד SPF50,,0.00,100.00,false,1.00,44.90,0.00,true,0,
7290113880054,false,לייף מ.הגנה 50+ סטיק שקוף 50 מל לפנים ול,אמיליה קוסמטיקס,IL,סטיק הגנה שקוף לפנים ולגוף SPF+50 לעור רגיש,,0.00,100.00,false,1.00,39.90,0.00,true,0,
7290113880061,false,לייף מ.הגנה 30 100 מל ספריי תחליבי לילדי,General,IL,KIDS ספריי תחליבי כתום לעור רגיש SPF30 לילדים לעור רגיש,,0.00,0.00,false,1.00,19.90,0.19,true,0,
7290113880078,false,לייף מ.הגנה 30 100 מל ספריי שקוף,General,IL,ספריי שקוף לעור רגיש SPF30,,0.00,0.00,false,1.00,19.90,0.19,true,0,
7290113880085,false,לייף מ.הגנה 50 250 מל תחליב לילדים ללא א,General,IL,KIDS תחליב הגנה לילדים SPF50,,0.00,100.00,false,1.00,39.90,0.00,true,0,
7290113880108,false,גון פרידה ווליום ליפט - שמפו מעניק נפח,General,FR,ווליום ליפט - שמפו מעניק נפח,,0.00,100.00,false,1.00,34.90,0.00,true,0,
7290113880115,false,גון פרידה ווליום ליפט - מרכך מעניק נפח,General,FR,ווליום ליפט - מרכך מעניק נפח,,0.00,100.00,false,1.00,34.90,0.00,true,0,
7290113880528,false,סו.קו רולר עיסוי דו ראשי,General,CN,רולר עיסוי דו ראשי,,0.00,0.00,false,1.00,69.90,0.00,true,0,
7290113880818,false,לייף קרם גוף אלוורה 200 מל 30 SPF,אמיליה קוסמטיקס,IL,PROTECTING & SOOTHING  תחליב גוף מועשר באלוורה וקקטוס 30 SPF,,0.00,100.00,false,1.00,49.90,0.00,true,0,
7290113880825,false,לייף קרם יום אלוורה על בסיס מים,אמיליה קוסמטיקס,IL,HYDRATING & SOOTHING ג'ל לחות מרגיע לפנים מועשר באלוורה וקקטוס,,0.00,100.00,false,1.00,39.90,0.00,true,0,
7290113880832,false,לייף מסכת אלוורה SOS,אמיליה קוסמטיקס,IL,HYDRATING & REVITALIZING מסכת לחות מעוררת לפנים מועשרת באלוורה וקקטוס,,0.00,0.00,false,1.00,39.90,0.00,true,0,
7290113880863,false,סט 3 בגד גוף ספארי אפור 0-3 חורף 22,General,,סט בגד גוף ספארי אפור 0-3 חורף,,0.00,0.00,false,1.00,59.90,19.96,true,0,
7290113880931,false,סט 3 מכנסיים אפור 3-6 חורף 22,General,,סט מכנסיים אפור 3-6 חורף,,0.00,0.00,false,1.00,42.90,14.30,true,0,
7290113880955,false,סט 3 מכנסיים ורוד 0-3 חורף 22,General,,סט מכנסיים ורוד 0-3 חורף,,0.00,0.00,false,1.00,42.90,14.30,true,0,
7290113880962,false,סט 3 מכנסיים ורוד 3-6 חורף 22,General,,סט מכנסיים ורוד 3-6 חורף,,0.00,0.00,false,1.00,42.90,14.30,true,0,
7290113890046,false,כובע שחור כוכבים 0-6 חורף 22,ביו טכנולוגיה,,כובע שחור כוכבים 0-6 חורף,,0.00,0.00,false,1.00,24.90,24.90,true,0,
7290113890084,false,אוברול פליז שחור כוכבים 3-6 חורף 22,ביו טכנולוגיה,,אוברול פליז שחור כוכבים 3-6 חורף,,0.00,0.00,false,1.00,39.90,39.90,true,0,
7290113890091,false,אוברול פליז שחור כוכבים 6-12 חורף 22,ביו טכנולוגיה,,אוברול פליז שחור כוכבים 6-12 חורף,,0.00,0.00,false,1.00,39.90,39.90,true,0,
7290113890251,false,פאפים חטיף דגנים בשקית - טבעי,גלעם,IL,פאפים חטיף דגנים חיטה ושיבולת שועל בשקית בטעם טבעי,,0.00,100.00,false,1.00,6.90,0.00,true,0,
7290113890268,false,פאפים חטיף דגנים בשקית - גזר וסלק,גלעם,IL,פאפים חטיף דגנים חיטה ושיבולת שועל בשקית בטעם גזר וסלק,,0.00,100.00,false,1.00,6.90,0.00,true,0,
7290113890275,false,סאנדיי 8 קפסולות כביסה ACTIVE POWER דו פ,לייף,IL,קפסולות ג'ל לכביסה ACTIVE POWER מארז התנסות,,0.00,0.00,false,1.00,8.90,1.11,true,0,
7290113890299,false,סאנדיי 50 קפסולות כביסה ACTIVE POWER דו,לייף,IL,קפסולות ג'ל לכביסה ACTIVE POWER,,0.00,0.00,false,1.00,31.90,0.63,true,0,
7290113890435,false,לייף וולנס פופקורן בטעם טבעי בתוספת מלח,לייף,GR,פופקורן בטעם טבעי בתוספת מלח,,0.00,100.00,false,1.00,4.90,0.00,true,0,
7290113890459,false,לייף בייביז כוס לחטיפים,ויטאל בייבי,CN,כוס לחטיפים,,0.00,0.00,false,1.00,29.90,0.00,true,0,
7290113900509,false,לייף בייביז שלישייה סינר קשירה מיני מאוס,General,,סינר לתינוק עם קשירה מיני מאוס,,0.00,0.00,false,1.00,19.90,6.63,true,0,
7290113900646,false,סו.קו - זוג צילרים,General,CN,צ'ילרים המסייעים להזרמת הדם ולהענקת מראה עור זוהר ומלא חיים,,0.00,0.00,false,1.00,59.90,0.00,true,0,
7290113900684,false,סאנדיי מרכך כביסה מרוכז ורוד 1ל WONDERS,זוהר דליה,IL,מרכך כביסה מרוכז ורוד בניחוח פרחי ילנג רוז ואמבר,,0.00,1.00,false,1.00,14.90,14.90,true,0,
7290113900837,false,אפודה פליז שחור כוכבים 6-12 חורף 22,מיננה,CN,אפודה פליז שחור כוכבים 6-12 חורף,,0.00,0.00,false,1.00,34.90,0.00,true,0,
7290113900875,false,אפודה פליז שחור כוכבים 12-18 חורף 22,מיננה,CN,אפודה פליז שחור כוכבים 12-18 חורף,,0.00,0.00,false,1.00,34.90,0.00,true,0,
7290113900912,false,סאפורה קוביות וופלים במילוי קרם קקאו 250,לייף,FR,קוביות וופלים במילוי קרם קקאו,,0.00,100.00,false,1.00,9.90,0.00,true,0,
7290114600941,false,מאסטר שף מיונז הולנדי לחיץ 435 גרם,שסטוביץ,NL,מיונז הולנדי,,0.00,100.00,false,1.00,14.90,0.00,true,0,
7290114603553,false,מאסטר שף עגבניות חתוכות גס 800 גרם,שסטוביץ,IT,עגבניות חתוכות גס,,0.00,100.00,false,1.00,12.90,0.00,true,0,
7290114604901,false,מאסטר שף ממרח שום לחיץ 444 גרם,שסטוביץ,NL,ממרח מתובל שום - לחיץ,,0.00,100.00,false,1.00,14.90,0.00,true,0,
