code,internal_code,name,manufacturer_name,manufacture_country,manufacturer_item_description,unit_qty,quantity,unit_of_measure,weighted,qty_in_package,price,unit_of_measure_price,allow_discount,status,item_id
7290017440286,false,דר פישר קידס מרכך ויטמינים 750 מל,מדי פישר,IL,KIDS מרכך ויטמינים,,0.00,100.00,false,1.00,16.90,0.00,true,0,
7290017440309,false,דר פישר קידס שמפו ויטמינים 750 מל,מדי פישר,IL,KIDS שמפו ויטמינים,,0.00,100.00,false,1.00,16.90,0.00,true,0,
7290017440323,false,דר פישר קידס שמפו ומרכך ויטמינים 750 מל,מדי פישר,IL,KIDS שמפו+מרכך ויטמינים,,0.00,100.00,false,1.00,16.90,0.00,true,0,
7290017440682,false,ד.פישר בלונד שמפו לשיער בהיר,מדי פישר,IL,BLOND שמפו לשיער בהיר-בלונדיני,,0.00,100.00,false,1.00,29.90,0.00,true,0,
7290017440699,false,ד.פישר בלונד מרכך לשיער בהיר 400 מל,מדי פישר,IL,BLOND מרכך לשיער בהיר-בלונדיני,,0.00,100.00,false,1.00,29.90,0.00,true,0,
7290017440729,false,אולטרסול ספריי שמן קוקוס 200/20 SPF,General,IL,ספריי שמן יבש וקליל SPF20 שמן קוקוס,,0.00,100.00,false,1.00,49.90,0.00,true,0,
7290017440798,false,ד.פישר סילבר מרכך לשיער כסוף 400 מל,מדי פישר,IL,SILVER מרכך לשיער כסוף,,0.00,100.00,false,1.00,29.90,0.00,true,0,
7290017440804,false,ד.פישר סילבר מסכת הזנה לשיער כסוף 300 מ,מדי פישר,IL,SILVER מסכת הזנה לשיער כסוף,,0.00,100.00,false,1.00,39.90,0.00,true,0,
7290017440965,false,קמיל אל סבון ניקיון ולחות 1 ליטר לבן,מדי פישר,IL,אל סבון לניקוי ולהזנת העור. מועשר בויטמין E ושמן זית,,0.00,1.00,false,1.00,15.90,15.90,true,0,
7290017457727,false,סוד מרכך מרוכז כחול +20% בושם 900 מל,גורי,IL,מרכך כביסה מרוכז כחול ניחוח מתמשך,,0.00,100.00,false,1.00,12.90,0.00,true,0,
7290017457734,false,סוד מרכך מרוכז ורוד +20% בושם 900 מל,גורי,IL,מרכך כביסה מרוכז ורוד ניחוח מתמשך,,0.00,100.00,false,1.00,12.90,0.00,true,0,
7290017457925,false,סוד מרכך מרוכז פרש ורוד 900 מל,גורי,IL,מרכך מרוכז לכביסה פרש קונטרול ורוד,,0.00,100.00,false,1.00,12.90,0.00,true,0,
7290017457932,false,סוד מרכך מרוכז פרש כחול 900 מל,גורי,IL,מרכך מרוכז לכביסה פרש קונטרול כחול,,0.00,100.00,false,1.00,12.90,0.00,true,0,
7290017513850,false,תה ירוק נענע עם ויטמינים C+D,ויסוצקי,,תה ירוק נענע עם ויטמינים C ו-D,,0.00,0.00,false,1.00,26.90,1.07,true,0,
7290017637426,false,MB שמפו למניעת קשקשים 500 מל,General,IL,שמפו למניעת קשקשים ANTI DANDRUFF,,0.00,100.00,false,1.00,24.90,0.00,true,0,
7290017637532,false,MB שמפו לשיער בלונד/בהיר 500 מל BLOND,General,IL,שמפו לשיער בלונד/בהיר BLOND,,0.00,100.00,false,1.00,39.90,0.00,true,0,
7290017637549,false,MB מרכך לשיער בלונד/בהיר 500 מל BLOND,General,IL,מרכך לשיער בלונד/בהיר BLOND,,0.00,100.00,false,1.00,39.90,0.00,true,0,
7290017637556,false,MB שמפו לקרקפת שומנית 500 מל,General,IL,שמפו לקרקפת שומנית CLEANSING,,0.00,100.00,false,1.00,24.90,0.00,true,0,
7290017637563,false,MB שמפו לתלתלים מושלמים 500 מל CURLS,General,IL,שמפו לתלתלים מושלמים CURLS,,0.00,100.00,false,1.00,24.90,0.00,true,0,
7290017637570,false,MB מרכך לתלתלים מושלמים 500 מל CURLS,General,IL,מרכך לתלתלים מושלמים CURLS,,0.00,100.00,false,1.00,24.90,0.00,true,0,
7290017637587,false,MB קרם לתלתלים מושלמים 200 CURLS,General,IL,קרם לתלתלים מושלמים CURLS,,0.00,100.00,false,1.00,27.90,0.00,true,0,
7290017637594,false,MB שמפו לשיער רגיל 500 מל MEMORIES,General,IL,שמפו לשיער רגיל SWEET MEMORIES EVERDAY,,0.00,100.00,false,1.00,24.90,0.00,true,0,
7290017637600,false,MB מרכך לשיער רגיל 500 מל MEMORIES,General,IL,מרכך לשיער רגיל SWEET MEMORIES EVERDAY,,0.00,100.00,false,1.00,24.90,0.00,true,0,
7290017637617,false,MB מסיכת הזנה לשיער רגיל 250 מל MEMORIES,General,IL,מסיכת הזנה לשיער רגיל SWEET MEMORIES EVERDAY,,0.00,100.00,false,1.00,27.90,0.00,true,0,
7290017637624,false,MB שמפו לשיער רגיל 500 מל JASMINE,General,IL,שמפו לשיער רגיל MAGICAL JASMINE EVERDAY,,0.00,100.00,false,1.00,24.90,0.00,true,0,
7290017637631,false,MB מרכך לשיער רגיל 500 מל JASMINE,General,IL,מרכך לשיער רגיל MAGICAL JASMINE EVERDAY,,0.00,100.00,false,1.00,24.90,0.00,true,0,
7290017637648,false,MB מסיכת הזנה לשיער רגיל 250 מל JASMINE,General,IL,מסיכת הזנה לשיער רגיל MAGICAL JASMINE EVERDAY,,0.00,100.00,false,1.00,27.90,0.00,true,0,
7290017637655,false,MB שמפו ללא מלחים 500 מל KERATIN,General,IL,שמפו ללא מלחים KERATIN,,0.00,100.00,false,1.00,29.90,0.00,true,0,
7290017637662,false,MB שמפו להדגשת גוונים זהובים SHIMMER 500,General,IL,שמפו להדגשת גוונים זהובים SHIMMER,,0.00,100.00,false,1.00,24.90,0.00,true,0,
7290017637679,false,MB מרכך להדגשת גוונים זהובים SHIMMER 500,General,IL,מרכך להדגשת גוונים זהובים SHIMMER,,0.00,100.00,false,1.00,24.90,0.00,true,0,
7290017637761,false,MB מרכך ללא מלחים 500 מל KERATIN,General,IL,מרכך ללא מלחים KERATIN,,0.00,100.00,false,1.00,29.90,0.00,true,0,
7290017847146,false,מגנוקס מסכה לפנים,נוה פארמה,IL,מגנוקס מסכה רב פעמית לפנים,,0.00,0.00,false,1.00,34.90,0.00,true,0,
7290017847160,false,מגנוקס מסכה לפנים JUNIOR,נוה פארמה,IL,מגנוקס מסכה רב פעמית לפנים JUNIOR,,0.00,0.00,false,1.00,34.90,0.00,true,0,
7290017871370,false,פמלי יהלום סבון ידיים מועשר בשמן אבוקדו,דנשר,TR,סבון לניקוי וטיפוח עור הידיים מועשר בשמן אבוקדו,,0.00,100.00,false,1.00,10.90,0.00,true,0,
7290017872001,false,קרם החתלה לתינוק שמן זית ופרופוליס 100 ס,דנשר,IL,קרם החתלה לתינוק שמן זית ופרופוליס,,0.00,0.00,false,1.00,12.90,0.12,true,0,
7290017872018,false,קרם החתלה לתינוק קמומיל וקלנדולה 100 סמק,דנשר,IL,קרם החתלה לתינוק קמומיל וקלנדולה,,0.00,0.00,false,1.00,12.90,0.12,true,0,
7290017872056,false,פמלי אל סבון 500 סדרה לבנה מעורב שלישייה,דנשר,TR,אל סבון מפנק מעורב קמומיל/מאסק/קוקוס,,0.00,1.00,false,1.00,16.90,11.26,true,0,
7290017872230,false,פרש וונס מגבונים נטורל 100 יח דיספנסר,דנשר,IL,מגבונים לחים בניחוח מרענן נטורל עם דיספנסר,,0.00,0.00,false,1.00,10.90,0.10,true,0,
7290017872742,false,שעווה למיקרוגל 500 ג-מועשרת בשמן המפ,דנשר,IL,שעווה לחימום במיקרוגל - מועשרת בשמן המפ,,0.00,100.00,false,1.00,27.90,0.00,true,0,
7290017872865,false,בייביביס חטיפי דגנים אפויים-גזר ועגבנייה,דנשר,,חטיפי דגנים אפויים לתינוקות בטעם גזר ועגבנייה,,0.00,100.00,false,1.00,14.90,0.00,true,0,
7290017872872,false,בייביביס חטיפי דגנים אפויים-גזר וסלק,דנשר,,חטיפי דגנים אפויים לתינוקות בטעם גזר וסלק,,0.00,100.00,false,1.00,14.90,0.00,true,0,
7290017872957,false,אדג מכשיר גילוח ידית+3 סכינים-לעור רגיש,General,US,מכשיר גילוח רב פעמי ידית+ 3 סכינים לעור רגיש,,0.00,0.00,false,1.00,59.90,59.90,true,0,
7290017872964,false,אדג מכשיר גילוח ידית+3 סכינים-לחות מוגבר,General,US,מכשיר גילוח רב פעמי ידית+ 3 סכינים לחות מוגברת,,0.00,0.00,false,1.00,59.90,59.90,true,0,
7290017872971,false,אדג 4 סכיני גילוח לעור רגיש,General,US,סכיני גילוח לעור רגיש,,0.00,0.00,false,1.00,49.90,12.47,true,0,
7290017872988,false,אדג 4 סכיני גילוח לחות מוגברת,General,US,סכיני גילוח לחות מוגברת,,0.00,0.00,false,1.00,49.90,12.47,true,0,
7290017873152,false,דאק גל לניקוי בניחוח לבנדר 750 מל זוג,דנשר,NL,ג'ל לניקוי מתקדם ניחוח לבנדר,,0.00,100.00,false,1.00,19.90,0.00,true,0,
7290017917030,false,אולטרסול שמן קוקוס 200/20 SPF,General,IL,ספריי שמן SPF20 שמן קוקוס,,0.00,100.00,false,1.00,49.90,0.00,true,0,
7290017917054,false,יולקטין קרם כף רגל טיפולי אקסטרה 15%,מדי פישר,IL,קרם כף רגל טיפולי אקסטרה 15%,,0.00,100.00,false,1.00,79.90,0.00,true,0,
7290017917085,false,יולקטין חמאת גוף טיפולית 200 מל,מדי פישר,IL,חמאת גוף טיפולית לעור יבש במיוחד,,0.00,100.00,false,1.00,59.90,0.00,true,0,
7290017917092,false,אולטרסול FREE קרם פנים לילדים SPF50,General,IL,FREE KIDS קרם פנים לילדים SPF50 לעור רגיש,,0.00,100.00,false,1.00,49.90,0.00,true,0,
7290017917108,false,אולטרסול FREE תחליב הגנה לילדים SPF50,General,IL,FREE KIDS תחליב הגנה לילדים SPF50 לעור רגיש,,0.00,100.00,false,1.00,59.90,0.00,true,0,
7290017917184,false,אולטרסול גל אלוורה פורטה 200 מל,מדי פישר,IL,ג'ל אלוורה פורטה לטיפול והרגעה מיידית,,0.00,100.00,false,1.00,39.90,0.00,true,0,
7290017917382,false,קמיל אל סבון להרגעת העור 1 ליטר ירוק,מדי פישר,IL,אל סבון היגייני לניקוי יסודי ולהרגעת העור מועשר בויטמין E ובתמצית אלוורה,,0.00,1.00,false,1.00,15.90,15.90,true,0,
7290017917399,false,קמיל בלו סנסטיב מגבוני תפרחת חיתולים,מדי פישר,IL,סנסיטיב מגבונים לסיוע בטיפול ובמניעת תפרחת חיתולים,,0.00,0.00,false,1.00,14.90,0.14,true,0,
7290017917450,false,קמיל בלו צמחי מרפא אל סבון ושמפו 1 ליטר,מדי פישר,IL,סנסיטיב אל סבון ושמפו לתינוק מועשר בצמחי מרפא,,0.00,1.00,false,1.00,32.90,32.90,true,0,
7290017917467,false,קמיל בלו סנס.אלסבון 1 ליטר שיבולת שועל,מדי פישר,IL,סנסיטיב שיבולת שועל אל סבון טיפולי לתינוק,,0.00,1.00,false,1.00,32.90,32.90,true,0,
7290017917559,false,ד.פישר בלונד מסכת הזנה לשיער בהיר 300 מל,מדי פישר,IL,BLOND מסכת הזנה לשיער בהיר-בלונדיני,,0.00,100.00,false,1.00,39.90,0.00,true,0,
7290017917566,false,ד.פישר סילבר שמפו לשיער כסוף ללא מלח,מדי פישר,IL,SILVER שמפו לשיער כסוף ללא תוספת מלח,,0.00,100.00,false,1.00,39.90,0.00,true,0,
7290017917573,false,אולטרסול קידס ספריי תחליבי SPF50 200,מדי פישר,IL,ספריי תחליבי לילדים 50,,0.00,100.00,false,1.00,54.90,0.00,true,0,
7290017917580,false,אולטרסול ספקטרום קרם פנים +50 50 מל,General,IL,אולטרסול ספקטרום קרם פנים +SPF50,,0.00,100.00,false,1.00,59.90,0.01,true,0,
7290017917610,false,אולטרסול ספקטרום ספריי תחליבי +50 200 מל,General,IL,ספקטרום ספריי תחליבי +SPF50,,0.00,100.00,false,1.00,69.90,0.00,true,0,
7290017917757,false,ד.פישר אפקטיב קר קרם גוף מועשר בשמן כותנ,מדי פישר,IL,קרם גוף מועשר בשמן כותנה,,0.00,100.00,false,1.00,24.90,0.00,true,0,
7290017917764,false,ד.פישר אפקטיב קר קרם גוף מועשר בשמן ארגן,מדי פישר,IL,קרם גוף מועשר בשמן ארגן,,0.00,100.00,false,1.00,24.90,0.00,true,0,
7290017917931,false,יולקטין קרם ידיים טיפולי פורטה 10%,מדי פישר,IL,קרם ידיים טיפולי פורטה 10%,,0.00,0.00,false,1.00,49.90,0.49,true,0,
7290017917986,false,אולטרסול בייבי נטורל תחליב גוף +50 125מל,מדי פישר,IL,בייבינטורל תחליב הגנה לתינוק +SPF50,,0.00,100.00,false,1.00,59.90,0.00,true,0,
7290017917993,false,אולטרסול FREE ספריי שקוף SPF50 200,מדי פישר,IL,FREE ספריי שקוף 50SPF,,0.00,100.00,false,1.00,59.90,0.00,true,0,
7290017928449,false,בייגלה שטוחלה PRO עם מלח 170 גרם,דנשר,IL,בייגלה שטוח'לה PRO עם מלח,,0.00,100.00,false,1.00,11.90,0.00,true,0,
7290017928746,false,מאיר בייגל פירורי בייגלה 200 גרם,דנשר,IL,פירורי בייגלה,,0.00,100.00,false,1.00,8.90,0.00,true,0,
7290017946283,false,דיאדרמין מים מסילרים לעור רגיל 3 ב-1,הנקל סוד,SI,מים מסילרים לעור רגיל 3 ב-1,,0.00,100.00,false,1.00,39.90,0.00,true,0,
7290017946979,false,פרסיל גל לכביסה דיפ קלין מנטרל ריחות 2.4,גורי,IL,ג'ל לכביסה פעולת היגיינה ונטרול ריחות לא נעימים,,0.00,1.00,false,1.00,36.90,15.37,true,0,
7290018028476,false,פרובן קרם רגליים טיפולי 75 מל,General,IL,קרם רגליים טיפולי,,0.00,100.00,false,1.00,129.00,0.01,true,0,
7290018028483,false,פרובן קרם ידיים טיפולי 75 מל,General,IL,קרם ידיים טיפולי,,0.00,100.00,false,1.00,89.00,0.01,true,0,
7290018043592,false,אול אין משקה מי חלבון בטעם אפרסק-500 מל,לייף,IT,אול אין משקה מי חלבון בטעם אפרסק,,0.00,100.00,false,1.00,15.90,0.00,true,0,
7290018043608,false,אול אין משקה מי חלבון פירות יער -500 מל,לייף,IT,אול אין משקה מי חלבון בטעם פירות יער,,0.00,100.00,false,1.00,15.90,0.00,true,0,
7290018080061,false,מאמי קר מברשת אצבע סיליקון,General,CN,מברשת אצבע דו צדדית מסיליקון לצחצוח השיניים ועיסוי החניכיים,,0.00,0.00,false,1.00,19.90,0.00,true,0,
7290018080160,false,מאמי קר מגבוני קלנדולה היפואלרגנים *4,General,IL,מגבוני קלנדולה היפואלרגנים,,0.00,0.00,false,1.00,23.90,5.97,true,0,
7290018080252,false,מאמי קר משחת החתלה טיפולית פורטה 80 מל,General,IL,משחת החתלה טיפולית פורטה למניעה וטיפול בתפרחת חיתולים,,0.00,100.00,false,1.00,29.90,0.00,true,0,
7290018080276,false,מאמי קר רפידות הנקה 60 יחידות,General,CN,רפידות הנקה חד פעמיות,,0.00,0.00,false,1.00,49.90,0.83,true,0,
7290018080511,false,מאמי קייר שמפו קמומיל לתינוק 400 מל,General,IL,שמפו קמומיל עדין לתינוק,,0.00,100.00,false,1.00,35.90,0.00,true,0,
7290018080528,false,מאמי קייר סבון קמומיל לתינוק 400 מל,General,IL,סבון קמומיל עדין לתינוק,,0.00,100.00,false,1.00,35.90,0.00,true,0,
7290018080542,false,מאמי קר מברשת שיניים בננה מסיליקון,General,CN,מברשת בננה מסיליקון לצחצוח השיניים,,0.00,0.00,false,1.00,39.90,0.00,true,0,
7290018080559,false,מאמי קר מברשת שיניים מסיליקון לתינוק,General,CN,מברשת שיניים לתינוק מסיליקון רך ואיכותי,,0.00,0.00,false,1.00,28.90,0.00,true,0,
7290018080702,false,מאמי קר תרמוס נירוסטה 580 מל,General,CN,תרמוס נירוסטה,,0.00,0.00,false,1.00,119.00,0.00,true,0,
7290018104002,false,פיליפס ONE BLADE מכשיר לפנים ולגוף 60,כמיפל,ID,"ONE BLADE, מכשיר לעיצוב זיפים וגילוח לפנים ולגוף 60 דקות פעולה",,0.00,0.00,false,1.00,339.90,0.00,true,0,
7290018104675,false,פיליפס ONE BLADE מכשיר פנים וגוף 30,כמיפל,ID,"ONE BLADE, מכשיר לעיצוב זיפים וגילוח פנים וגוף 30 דקות פעולה",,0.00,0.00,false,1.00,249.90,0.00,true,0,
7290018132067,false,נאן סופרים שלב 1 700 גרם,General,IL,סופרים תרכובת מזון לתינוקות שלב 1,,0.00,100.00,false,1.00,92.90,0.00,true,0,
7290018132081,false,נאן סופרים שלב 3 700 גרם,General,IL,סופרים תרכובת מזון המשך לפעוטות שלב 3,,0.00,100.00,false,1.00,92.90,0.00,true,0,
7290018132104,false,נאן סופרים שלב 2 700 גרם,General,IL,סופרים תרכובת מזון המשך לתינוקות שלב 2,,0.00,100.00,false,1.00,92.90,0.00,true,0,
7290018132388,false,מטרנה גולד בדץ שלב 2 700 גרם,אסם,IL,"גולד תרכובת מזון המשך לתינוקות על בסיס חלבי שלב 2 כשרות בד""ץ",,0.00,100.00,false,1.00,74.90,0.00,true,0,
7290018132425,false,מטרנה גולד בדץ שלב 3 700 גרם,אסם,IL,"גולד תרכובת מזון המשך לפעוטות על בסיס חלבי שלב 3 כשרות בד""ץ",,0.00,100.00,false,1.00,74.90,0.00,true,0,
7290018132463,false,מטרנה גולד TO GO שלב 1 בדץ,אסם,IL,"גולד תרכובת מזון לתינוקות על בסיס חלבי שלב 1 כשרות בד""ץ מארז TO GO",,0.00,100.00,false,1.00,14.90,0.00,true,0,
7290018156056,false,אולטרסול סטיק הגנה לפנים +50,General,IL,סטיק לפנים להגנה מהשמש +SPF50,,0.00,100.00,false,1.00,49.90,0.03,true,0,
7290018156063,false,אולטרסול קידס סטיק הגנה לפנים +50 לילדים,מדי פישר,IL,סטיק לפנים לילדים להגנה מהשמש +50,,0.00,100.00,false,1.00,49.90,0.03,true,0,
7290018156087,false,סרקל אקטיב שמפו 450 מל,מדי פישר,IL,אקטיב שמפו טיפולי מחוזק להיגיינת השיער,,0.00,100.00,false,1.00,34.90,0.00,true,0,
7290018156445,false,אולטרסול בייבי נטורל סטיק לתינוק להגנה50,מדי פישר,IL,בייבינטורל סטיק לתינוק להגנה מהשמש +SPF50,,0.00,100.00,false,1.00,49.90,0.03,true,0,
7290018156452,false,גנסיס סאן קרם יום מגן +BB בתוספת גוון מד,מדי פישר,IL,SUN קרם יום מגן +BB בתוספת גוון מדיום,,0.00,100.00,false,1.00,64.90,0.01,true,0,
7290018156469,false,גנסיס סאן קרם יום מגן +BB בתוספת גוון בה,מדי פישר,IL,SUN קרם יום מגן +BB בתוספת גוון בהיר,,0.00,100.00,false,1.00,64.90,0.01,true,0,
7290018156506,false,אולטרסול קרם פנים SPF50 טו גו 30 מל,General,IL,קרם פנים SPF50 טו גו,,0.00,100.00,false,1.00,19.90,0.00,true,0,
7290018156568,false,אולטרסול MED קרם פנים לחות SPF50+ 24H,מדי פישר,IL,קרם פנים לחות  24H להגנה גבוהה מאוד מהשמש  +SPF50 לעור רגיש,,0.00,100.00,false,1.00,79.90,0.01,true,0,
7290018156575,false,אולטרסול MED תחליב גוף SPF50+,מדי פישר,IL,תחליב גוף להגנה גבוהה מאוד מהשמש +SPF50 לעור רגיש,,0.00,100.00,false,1.00,89.90,0.00,true,0,
7290018156582,false,אולטרסול MED קרם פנים משקם,מדי פישר,IL,קרם פנים משקם עוצמתי לאחר החשיפה לשמש לעור רגיש,,0.00,100.00,false,1.00,79.90,0.01,true,0,
7290018156612,false,יולקטין SEBO גל מקציף לפנים לעור רגיש,מדי פישר,IL,SEBO ג'ל מקציף לפנים לעור רגיש,,0.00,100.00,false,1.00,69.90,0.00,true,0,
7290018156629,false,יולקטין SEBO קרם יום לעור רגיש,מדי פישר,IL,SEBO קרם יום לעור רגיש,,0.00,100.00,false,1.00,99.90,0.01,true,0,
7290018156636,false,יולקטין SEBO קרם לילה לעור רגיש,מדי פישר,IL,SEBO קרם לילה לעור רגיש,,0.00,100.00,false,1.00,99.90,0.01,true,0,
7290018156735,false,יולקטין קרם ידיים טיפולי 230 מל משאבה,מדי פישר,IL,קרם ידיים טיפולי לטיפול אינטנסיבי והקלה מיידי,,0.00,100.00,false,1.00,72.90,0.00,true,0,
7290018156780,false,אלכוקרם קרם גל 75 מל פרש,מדי פישר,IL,אלכו-ג'ל קרם ג'ל לשמירה על היגיינת הידיים מועשר בלחות 2ב1 פרש,,0.00,100.00,false,1.00,19.90,0.00,true,0,
7290018156834,false,אולטרסול ספורט MAX קרם פנים 50 SPF50,מדי פישר,IL,ספורט מקס קרם פנים לספורט ימי +SPF50,,0.00,100.00,false,1.00,49.90,0.00,true,0,
7290018156841,false,אולטרסול MED ספריי שקוף SPF50+,מדי פישר,IL,ספריי שקוף להגנה גבוהה מאוד מהשמש +SPF50 לעור רגיש,,0.00,100.00,false,1.00,89.90,0.00,true,0,
7290018156858,false,אולטרסול MED קרם פנים מינרלי SPF50+,מדי פישר,IL,קרם פנים מינרלי להגנה גבוהה מאוד מהשמש +SPF50 לעור רגיש,,0.00,100.00,false,1.00,79.90,0.01,true,0,
7290018182635,false,קרפרי מגן תחתון מקסי לארג 48 יח,פארמה דיל,IT,מגני תחתון פלוס לארג' ניחוח עדין,,0.00,0.00,false,1.00,21.90,0.45,true,0,
7290018279052,false,פיור אויל מלח אנגלי טהור 500 גרם,תמר שיווק,IL,מלח אנגלי טהור,,0.00,100.00,false,1.00,54.90,0.00,true,0,
7290018343296,false,דר פישר אלכוגל H לידיים 100 מל,מדי פישר,IL,אלכו-ג'ל H - ג'ל לשמירת על היגיינת הידיים 70% אלכוהול,,0.00,0.00,false,1.00,9.90,0.09,true,0,
7290018343319,false,ד.פישר PERFECT CURLS שמפו לשיער מתולתל,מדי פישר,IL,PERFECT CURLS שמפו לשיער מתולתל,,0.00,100.00,false,1.00,29.90,0.00,true,0,
7290018343333,false,ד.פישר PERFECT CURLS מסכה לשיער מתולתל,מדי פישר,IL,PERFECT CURLS מסכת הזנה לשיער מתולתל,,0.00,100.00,false,1.00,39.90,0.00,true,0,
7290018343340,false,ד.פישר SMOOTH&REPAIR שמפו משקם לאחר החלק,מדי פישר,IL,SMOOTH&REPAIR שמפו משקם לאחר החלקה ללא תוספת מלח,,0.00,100.00,false,1.00,39.90,0.00,true,0,
7290018343357,false,ד.פישר SMOOTH&REPAIR מרכך משקם לאחר החלק,מדי פישר,IL,SMOOTH&REPAIR מרכך משקם לאחר החלקה ללא תוספת מלח,,0.00,100.00,false,1.00,39.90,0.00,true,0,
7290018343364,false,ד.פישר SMOOTH&REPAIR מסכה משקמת לאחר החל,מדי פישר,IL,SMOOTH&REPAIR מסכת הזנה משקמת לאחר החלקה ללא תוספת מלח,,0.00,100.00,false,1.00,39.90,0.00,true,0,
7290018343388,false,אלכוגל ספריי 100 מל,מדי פישר,IL,אלכו-ג'ל ספריי לשמירה על היגיינת הידיים SENSITIVE,,0.00,0.00,false,1.00,19.90,0.19,true,0,
7290018343630,false,ד.פישר אפקטיב קר קרם גוף מועשר חמאת קקאו,מדי פישר,IL,קרם גוף מועשר בחמאת קקאו,,0.00,100.00,false,1.00,24.90,0.00,true,0,
7290018343692,false,פארמה וויפס מגבונים לניקוי וחיטוי משט70%,מדי פישר,IL,פארמה וויפס מגבונים אנטי בקטריאליים לניקוי ולחיטוי משטחים ואביזרים 70% אלכוהול גדולים ועבים במיוחד,,0.00,0.00,false,1.00,24.90,0.41,true,0,
7290018344101,false,חטיף חלבון אפונה קקאו קפה 50 גרם,נורוליס,IL,חטיף חלבון אפונה קקאו קפה,,0.00,0.00,false,1.00,10.00,0.20,true,0,
7290018344996,false,חטיף מולטי ויטמין שוקולד קפה ללא סוכר 24,נורוליס,IL,חטיף מולטי ויטמין שוקולד קפה ללא סוכר,,0.00,0.00,false,1.00,9.00,0.37,true,0,
7290018439012,false,נוטריקר ביוטי קולגן H קרם פנים אנטי אייג,מרשל,IL,ביוטי קולגן H קרם פנים אנטי אייג'ינג,,0.00,100.00,false,1.00,149.90,0.02,true,0,
7290018440254,false,צאי קרמל מלוח,ויסוצקי,IL,חווית הצ'אי קרמל מלוח,,0.00,0.00,false,1.00,24.90,0.00,true,0,
7290018440391,false,מאטה תה ירוק מאטה נענע וגוארנה,ויסוצקי,IL,MATE תה ירוק מאטה נענע וגוארנה,,0.00,0.00,false,1.00,32.90,0.00,true,0,
7290018493045,false,ד.פישר אפקטיב קר קרם ידיים מועשר בקוקוס,מדי פישר,IL,קרם ידיים מועשר בשמן קוקוס הקלה מיידית לעור רגיל-יבש,,0.00,0.00,false,1.00,15.90,0.15,true,0,
7290018493069,false,ד.פישר אפקטיב קר קרם ידיים שמן כותנה,מדי פישר,IL,קרם ידיים מועשר בשמן כותנה,,0.00,0.00,false,1.00,15.90,0.15,true,0,
7290018493076,false,ד.פישר אפקטיב קר קרם ידיים שמן ארגן,מדי פישר,IL,קרם ידיים מועשר בשמן ארגן,,0.00,0.00,false,1.00,15.90,0.15,true,0,
7290018493144,false,קמיל אל סבון להרגעת העור 1 ליטר סגול,מדי פישר,IL,אל סבון היגייני לניקוי יסודי ולהרגעת העור מועשר בשמן ארגן,,0.00,1.00,false,1.00,15.90,15.90,true,0,
