code,internal_code,name,manufacturer_name,manufacture_country,manufacturer_item_description,unit_qty,quantity,unit_of_measure,weighted,qty_in_package,price,unit_of_measure_price,allow_discount,status,item_id
4011800567613,false,קורני סנדוויץ שחור לבן 4 יחידות,סידס,,שחור ולבן חטיף דגנים בטעם שוקולד עם 30% מילוי קרם חלב,,0.00,0.00,false,1.00,15.90,3.97,true,0,
4011800617615,false,קורני BIG שוקולד 50 גרם,סידס,DE,BIG חטיף שוקולד,,0.00,100.00,false,1.00,5.90,0.00,true,0,
4011800617714,false,קורני BIG שוקו בננה 50 גרם,סידס,DE,BIG חטיף שוקו בננה,,0.00,100.00,false,1.00,5.90,0.00,true,0,
4011800628512,false,קורני שוקולד חלב 6*1,סידס,,חטיף דגנים עם שוקולד חלב,,0.00,0.00,false,1.00,15.90,2.65,true,0,
4011800630515,false,קורני שוקולד חלב ובננה 6*1,סידס,,חטיף דגנים עם שוקולד חלב ובננה,,0.00,0.00,false,1.00,15.90,2.65,true,0,
4011800633516,false,קורני שוקולד מריר מעולה 58% קקאו 6*1,סידס,,חטיף דגנים עם שוקולד מריר מעולה,,0.00,0.00,false,1.00,15.90,2.65,true,0,
4011800636517,false,קורני פרי שוקולד חלב מעולה ללא סוכר 6*1,סידס,,פרי חטיף דגנים עם שוקולד חלב ללא תוספת סוכר,,0.00,0.00,false,1.00,15.90,2.65,true,0,
4012273123009,false,נטרוגינה קרם ידיים  50 מל הסדרה הנורבגית,שסטוביץ,FR,קרם ידיים הסדרה הנורבגית,,0.00,100.00,false,1.00,29.90,0.00,true,0,
4014400907902,false,וורטרס אורגינל ללא סוכר בקופסא,General,,סוכריות חמאה ללא סוכר,,0.00,100.00,false,1.00,7.90,0.00,true,0,
4014400923711,false,טופיפי 125 גרם,General,DE,,,0.00,100.00,false,1.00,14.90,0.00,true,0,
4015000280211,false,פה דאודורנט רול קאריבין לימון,General,,דאודורנט רול און קאריביאן לימון לאישה 48 שעות,,0.00,100.00,false,1.00,14.90,0.00,true,0,
4015000280372,false,פה דאודורנט רול לגבר,General,,דאודורנט רול און לגבר 48 שעות,,0.00,100.00,false,1.00,14.90,0.00,true,0,
4015000500838,false,טאפט גל למראה רטוב 150 מל,הנקל סוד,DE,ג'ל למראה רטוב  אחיזה 3,,0.00,100.00,false,1.00,19.90,0.00,true,0,
4015000519915,false,פה דאו ספריי פינק פארדייס 200 מל,General,,דאודורנט ספריי לאשה פינק,"מ""ל",200.00,100.00,false,1.00,14.90,0.00,true,0,
4015000535953,false,טאפט ווקס פאוור 75 מל,הנקל סוד,DE,"ווקס פאוור  לאחיזה חזקה במיוחד, אחיזה 5+",,0.00,100.00,false,1.00,29.90,0.00,true,0,
4015000535960,false,טאפט ספריי קשמיר 250 מל,הנקל סוד,DE,"ספריי פאוור קשמיר  למראה שיער מעוצב ורך כקשמיר, אחיזה 5",,0.00,100.00,false,1.00,29.90,0.00,true,0,
4015000535977,false,טאפט ספריי קפאין 250 מל,הנקל סוד,DE,"ספריי פאוור  למראה שיער חזק מהשורש ועד הקצוות, אחיזה 5",,0.00,100.00,false,1.00,29.90,0.00,true,0,
4015000537049,false,גליס שיקום עמוק 19 מרכך אקספ.200 מל,General,,קונדישינר משקם אקספרס לשיער יבש ופגום,,0.00,100.00,false,1.00,35.90,0.00,true,0,
4015000548106,false,טאפט מוס קשמיר 150 מל,הנקל סוד,DE,מוס פאוור קשמיר - ליצירת נפח ומראה שיער רך כקשמיר,,0.00,100.00,false,1.00,24.90,0.00,true,0,
4015000548847,false,טאפט גל סטנד אפ 150 מל,הנקל סוד,DE,ג'ל סטנד אפ  אחיזה 5,,0.00,100.00,false,1.00,19.90,0.00,true,0,
4015000615884,false,פה דאו ספריי ירוק,General,,דאודורנט ספריי ירוק לאישה,,0.00,100.00,false,1.00,14.90,0.00,true,0,
4015000615891,false,פה דאו ספריי כחול,General,,דאודורנט ספריי כחול לאישה,"מ""ל",200.00,100.00,false,1.00,14.90,0.00,true,0,
4015000615921,false,פה דאו ספריי לגבר,General,,דאודורנט ספריי לגבר,"מ""ל",200.00,100.00,false,1.00,14.90,0.00,true,0,
4015000712576,false,טאפט ספריי אולטרה 250 מל,הנקל סוד,DE,"ספריי אולטרה  לעיצוב וחיזוק סיב השערה עם ארג'ינין, דרגת חוזק 4",,0.00,100.00,false,1.00,29.90,0.00,true,0,
4015000923880,false,דיאדרמין ליפט+ קרם לחות נגד קמטים 50 מל,הנקל סוד,SI,+LIFT קרם יום נגד קמטים,,0.00,100.00,false,1.00,59.90,0.01,true,0,
4015000923989,false,דיאדרמין ליפט+ קרם הזנה ללילה נגד קמטים,הנקל סוד,SI,+LIFT קרם הזנה ללילה נגד קמטים,,0.00,100.00,false,1.00,59.90,0.01,true,0,
4015000950510,false,טאפט ספריי קרטין 250 מל,הנקל סוד,DE,"ספריי פיטו קרטין לעיצוב וחיזוק סיב השערה, אחיזה 4",,0.00,100.00,false,1.00,29.90,0.00,true,0,
4015000975421,false,סאיוס משחה לעיצוב השיער אינביזיבל 100 מל,הנקל סוד,,אינביזיבל משחה לעיצוב שיער,,0.00,0.00,false,1.00,39.90,0.39,true,0,
4015000995122,false,פה דאודורנט ספריי כח המשיכה,הנקל סוד,,דאודורנט ספריי כח המשיכה,,0.00,100.00,false,1.00,14.90,0.00,true,0,
4015000996273,false,גליס אויל אלקסיר מרכך 400 מל,הנקל סוד,,מרכך אולטימטיב שמן אלקסייר,,0.00,100.00,false,1.00,18.90,0.00,true,0,
4015000997430,false,פה דאודורנט ספריי אינויזיבל פאוור 200 מל,הנקל סוד,,דאודורנט ספריי אינויזיבל פאוור,,0.00,100.00,false,1.00,14.90,0.00,true,0,
4015001003055,false,טאפט ספריי אולטימייט 250 מל,הנקל סוד,DE,"ספריי אולטימייט  לאחיזה אולטימטיבית וברק קריסטלי, אחיזה 5+",,0.00,100.00,false,1.00,29.90,0.00,true,0,
4015001003079,false,טאפט ווקס אולטימייט 75 מל,הנקל סוד,DE,"ווקס אולטימייט  לאחיזה חזקה וברק קריסטלי, אחיזה 5+",,0.00,100.00,false,1.00,29.90,0.00,true,0,
4015001004168,false,גליס סרום שיקום עמוק מרכך אקספ.200 מל,General,SK,סרום שיקום עמוק קונדישינר משקם אקספרס,,0.00,100.00,false,1.00,35.90,0.00,true,0,
4015100190762,false,גליס מסכה שיקום שמן אלקסיר 300 מל,הנקל סוד,SK,מסכה שיקום שמן אלקסיר,,0.00,100.00,false,1.00,39.90,0.00,true,0,
4015100190786,false,גליס מסכה שיקום עמוק 300 מל,הנקל סוד,SK,מסכה שיקום עמוק,,0.00,100.00,false,1.00,39.90,0.00,true,0,
4015100190793,false,גליס מסכה שיקום אולטימטיבי 300 מל,הנקל סוד,SK,מסכה שיקום אולטימטיבי,,0.00,100.00,false,1.00,39.90,0.00,true,0,
4015100190892,false,דיאדרמין ליפט + סופר פילר קרם עיניים,הנקל סוד,SI,LIFT+ סופר פילר קרם עיניים,,0.00,100.00,false,1.00,69.90,0.04,true,0,
4015100202205,false,טאפט מוס מתולתל 150 מל,הנקל סוד,DE,"מוס תלתלים - לתלתלים מוגדרים וגמישים, אחיזה 3",,0.00,100.00,false,1.00,24.90,0.00,true,0,
4015100203523,false,דיאדרמין ליפט+ קפסולות לעור הפנים והצווא,הנקל סוד,DE,LIFT+  קפסולות לעור פנים והצוואר,,0.00,0.00,false,1.00,79.90,0.00,true,0,
4015100204087,false,סאיוס ספריי לשיער סלון פלקס 400 מל,הנקל סוד,DE,ספריי לשיער סלון פלקס,,0.00,100.00,false,1.00,47.90,0.00,true,0,
4015100297928,false,גליס ביו-טק קונדישינר משקם אקספרס 200 מל,הנקל סוד,SK,ביו-טק קונדישנר משקם אקספרס,,0.00,100.00,false,1.00,32.90,0.00,true,0,
4015100298000,false,גליס מסכה ביו-טק 2ב-1 300 מל,הנקל סוד,TR,ביו-טק מסכה עשירה 2 ב-1,,0.00,100.00,false,1.00,39.90,0.00,true,0,
4015100302059,false,גליס תחליב לשיער מאולף,הנקל סוד,HU,תחליב לשיער מאולף,,0.00,100.00,false,1.00,39.90,0.00,true,0,
4015100302134,false,גליס ספריי מעצב ומטפח,הנקל סוד,HU,ספריי מעצב ומטפח,,0.00,100.00,false,1.00,39.90,0.00,true,0,
4015100302219,false,גליס מוס למראה שיער מלא,הנקל סוד,HU,מוס למראה שיער מלא,,0.00,100.00,false,1.00,39.90,0.00,true,0,
4015100325294,false,פלטה דלוקס קיט 4-65 חום מהפנט,הנקל סוד,DE,DELUXE צבע שיער 4-65 חום מהפנט,,0.00,0.00,false,1.00,39.90,0.00,true,0,
4015100325324,false,פלטה דלוקס קיט 6-0 בלונד כהה,הנקל סוד,DE,DELUXE צבע שיער 6-0 בלונד כהה,,0.00,0.00,false,1.00,39.90,0.00,true,0,
4015100325355,false,פלטה דלוקס קיט 4-0 חום בינוני עדין,הנקל סוד,DE,DELUXE צבע שיער 4-0 חום בינוני עדין,,0.00,0.00,false,1.00,39.90,0.00,true,0,
4015100432534,false,דיאדרמין פיטו רטינול אמפולות להפחתת קמטי,הנקל סוד,SI,PHYTO RETINOL אמפולות  להפחתת קמטים,,0.00,0.00,false,1.00,59.90,0.00,true,0,
4015100438055,false,פלטה דלוקס קיט 7-0 בלונד בינוני,הנקל סוד,DE,DELUXE צבע שיער 7-0 בלונד בינוני,,0.00,0.00,false,1.00,39.90,0.00,true,0,
4015100438079,false,פלטה דלוקס קיט 8-0 בלונד בהיר,הנקל סוד,DE,DELUXE צבע שיער 8-0 בלונד בהיר,,0.00,0.00,false,1.00,39.90,0.00,true,0,
4015100438154,false,פלטה דלוקס קיט 10-1 בלונד כסוף,הנקל סוד,DE,DELUXE צבע שיער 10-1 בלונד כסוף,,0.00,0.00,false,1.00,39.90,0.00,true,0,
4015100438192,false,פלטה דלוקס קיט 8-65 בלונד זהוב חם,הנקל סוד,DE,DELUXE צבע שיער 8-65 בלונד זהוב חם,,0.00,0.00,false,1.00,39.90,0.00,true,0,
4015100438239,false,פלטה דלוקס קיט 5-5 קרמל,הנקל סוד,DE,DELUXE צבע שיער 5-5 קרמל,,0.00,0.00,false,1.00,39.90,0.00,true,0,
4015100438314,false,פלטה דלוקס קיט 12-2 בלונד טיטניום,הנקל סוד,DE,DELUXE צבע שיער 12-2 בלונד טיטניום,,0.00,0.00,false,1.00,39.90,0.00,true,0,
4015100709889,false,פלטה דלוקס קיט 1-08 שחור בורדו,הנקל סוד,DE,DELUXE צבע שיער 1-08 שחור בורדו,,0.00,0.00,false,1.00,39.90,0.00,true,0,
4015100709964,false,פלטה דלוקס קיט 11-11 בלונד אולטרה טיטניו,הנקל סוד,DE,DELUXE צבע שיער 11-11 בלונד אולטרה טיטניום,,0.00,0.00,false,1.00,39.90,0.00,true,0,
4015100710021,false,פלטה דלוקס קיט 5-1 חום בהיר קר,הנקל סוד,DE,DELUXE צבע שיער 5-1 חום בהיר קר,,0.00,0.00,false,1.00,39.90,0.00,true,0,
4015100744811,false,גליס טיפול משקם אקספרס שמן מזין 200 מל,הנקל סוד,HU,טיפול משקם אקספרס שמן מזין,,0.00,100.00,false,1.00,39.90,0.00,true,0,
4015400536857,false,פמפרס פרימיום חיתולים שלב 0 א.נשיאה 30יח,דיפלומט,PL,"חיתולים ניו בייבי שלב 0 3 ק""ג אריזת נשיאה",,0.00,0.00,false,1.00,21.90,0.73,true,0,
4015400562818,false,אולוויז מגן תחתון פלקסי סטייל סינגל 40 י,דיפלומט,DE,מגני תחתון פלקסי סטייל סלים מבושם,,0.00,0.00,false,1.00,16.90,0.42,true,0,
4015400563747,false,אולוויז מגן תחתון דואו נורמל 60 יח,דיפלומט,UA,מגני תחתון נורמל,,0.00,0.00,false,1.00,19.90,0.33,true,0,
4015400563846,false,אולוויז מגן תחתון לונג פלוס 44 יח,דיפלומט,DE,מגיני תחתון לונג פלוס,,0.00,0.00,false,1.00,19.90,0.45,true,0,
4015400564034,false,אולוויז מגן תחתון מגה פק לונג פלוס 58 יח,דיפלומט,DE,מגני תחתון לונג' פלוס,,0.00,0.00,false,1.00,32.90,0.56,true,0,
4015400564324,false,אולוויז מגן תחתון וליו פק לארג 52 יח,דיפלומט,DE,מגיני תחתון לארג',,0.00,0.00,false,1.00,19.90,0.38,true,0,
4015400564423,false,אולוויז מגן תחתון וליו פק פרש לארג 46 יח,דיפלומט,,מגני תחתון לארג' פרש,,0.00,0.00,false,1.00,19.90,0.43,true,0,
4015400564454,false,אולוויז מגן תחתון מגה פק לארג 68 יחידות,דיפלומט,DE,מגני תחתון לארג',,0.00,0.00,false,1.00,32.90,0.48,true,0,
4015400565574,false,אולוויז מגן תחתון וליו פק נורמל פרש58 יח,דיפלומט,,מגני תחתון פרש נורמל,,0.00,0.00,false,1.00,19.90,0.34,true,0,
4015400598329,false,אולוויז קוואטרו נורמל פלוס 56 יח תחבושות,דיפלומט,DE,תחבושות קווטרו נורמל פלוס עם כנפיים,,0.00,0.00,false,1.00,39.90,0.71,true,0,
4015400598381,false,אולוויז קוואטרו לונג פלוס 48 יח תחבושות,דיפלומט,DE,תחבושות קווטרו אולטרה לונג פלוס עם כנפיים,,0.00,0.00,false,1.00,39.90,0.83,true,0,
4015400598411,false,אולוויז קוואטרו לילה 40 יח תחבושות,דיפלומט,DE,תחבושות קוואטרו לילה עם כנפיים,,0.00,0.00,false,1.00,39.90,0.99,true,0,
4015400623663,false,מגבונים לחים ניו בייבי רביעייה ללא בישום,דיפלומט,DE,מגבונים לחים ללא בישום,,0.00,0.00,false,1.00,28.90,7.22,true,0,
4015400629368,false,אולוויז דיסקרט סמול פלוס 16 יח,דיפלומט,DE,דיסקרט תחבושות לבריחת שתן סמול פלוס,,0.00,0.00,false,1.00,24.90,1.55,true,0,
4015400681670,false,אולוויז לילה בטוח 18יח תחבושות וליו פק,דיפלומט,HU,תחבושות אולטרה עם כנפיים לילה בטוח אריזת דואו,,0.00,0.00,false,1.00,19.90,1.10,true,0,
4015400684428,false,אולוויז אינפיניטי נורמל 12 יח,General,HU,אינפיניטי עם כנפיים נורמל פלוס,,0.00,0.00,false,1.00,23.90,2.39,true,0,
4015400684480,false,אולוויז אינפיניטי לונג פלוס 11 יח,General,HU,אינפיניטי עם כנפיים לונג פלוס,,0.00,0.00,false,1.00,23.90,2.17,true,0,
4015400684534,false,אולוויז אינפיניטי לילה 10 יח,General,HU,אינפיניטי עם כנפיים לילה,,0.00,0.00,false,1.00,23.90,2.39,true,0,
4015400690313,false,טמפקס קומפאק פרל רגולר 18 יחידות,דיפלומט,HU,קומפאק פרל עם מוליך רגולר,,0.00,0.00,false,1.00,24.90,1.38,true,0,
4015400690405,false,טמפקס קומפאק פרל סופר 18 יחידות,דיפלומט,HU,קומפאק פרל עם מוליך סופר,,0.00,0.00,false,1.00,24.90,1.38,true,0,
4015400690498,false,טמפקס קומפאק פרל סופר פלוס 18 יחידות,דיפלומט,HU,קומפאק פרל עם מוליך סופר פלוס,,0.00,0.00,false,1.00,24.90,1.38,true,0,
4015400715290,false,טמפקס קומפאק סופר פלוס 22,דיפלומט,HU,קומפאק טמפונים עם מוליך סופר פלוס,,0.00,0.00,false,1.00,25.90,1.17,true,0,
4015400715320,false,טמפקס קומפאק רגולר 22,דיפלומט,HU,קומפאק טמפונים עם מוליך רגולר,,0.00,0.00,false,1.00,25.90,1.17,true,0,
4015400731719,false,אולוויז דואו לילה 20 יח תחבושות,דיפלומט,DE,תחבושות אולטרה עם כנפיים נייט אריזת דואו,,0.00,0.00,false,1.00,19.90,0.99,true,0,
4015400746812,false,אולוויז מגן תחתון מגה פק נורמל 80 יחידות,דיפלומט,DE,מגני תחתון נורמל,,0.00,0.00,false,1.00,32.90,0.41,true,0,
4015400755241,false,אולוויז דואו נורמל + 28 יח תחבושות,דיפלומט,DE,תחבושות אולטרה עם כנפיים נורמל אריזת דואו,,0.00,0.00,false,1.00,19.90,0.71,true,0,
4015400755487,false,אולוויז דואו לונג + 24 יח תחבושות,דיפלומט,DE,תחבושות אולטרה עם כנפיים לונג אריזת דואו,,0.00,0.00,false,1.00,19.90,0.82,true,0,
4015400824701,false,טמפקס פלאש 30 רגולר,General,,טמפונים עם מוליך רגולר,,0.00,0.00,false,1.00,29.90,0.99,true,0,
4015400824725,false,טמפקס פלאש 30 סופר,General,,טמפונים עם מוליך סופר,,0.00,0.00,false,1.00,29.90,0.99,true,0,
4015400824749,false,טמפקס פלאש 30 סופר פלוס,General,,טמפונים עם מוליך סופר פלוס,,0.00,0.00,false,1.00,29.90,0.99,true,0,
4015400844570,false,אולוויז דיסקרט מגן תחתון פלוס 24 יח,דיפלומט,DE,דיסקריט מגן תחתון פלוס לבריחת שתן,,0.00,0.00,false,1.00,24.90,1.03,true,0,
4015600592431,false,פנטן אמפולות לשיקום אינטנסיבי 3 יחידות,דיפלומט,GB,REPAIR&PROTECT אמפולות להצלת השיער תוך דקה,,0.00,0.00,false,1.00,24.90,0.00,true,0,
4015600763251,false,הד&שולדרס 600 שמפו קלאסי,דיפלומט,,שמפו למניעת קשקשים לשיער רגיל,,0.00,100.00,false,1.00,26.90,0.00,true,0,
4015600763299,false,הד&שולדרס 600 שמפו 2ב1 קלאסי,דיפלומט,,שמפו למניעת קשקשים 2 ב-1 לשיער רגיל,,0.00,100.00,false,1.00,26.90,0.00,true,0,
4015600763411,false,הד&שולדרס 600 שמפו מנטול,דיפלומט,,שמפו יומיומי למניעת קשקשים מנטול,,0.00,100.00,false,1.00,26.90,0.00,true,0,
4015600763459,false,הד&שולדרס 600 שמפו תפוח,דיפלומט,,שמפו יומיומי למניעת קשקשים תפוח,,0.00,100.00,false,1.00,26.90,0.00,true,0,
4015600763534,false,הד&שולדרס 600 שמפו מגע משי,דיפלומט,,שמפו יומיומי למניעת קשקשים מגע משי,,0.00,100.00,false,1.00,26.90,0.00,true,0,
4015600766658,false,הד&שולדרס 600 שמפו 2ב1 מנטול,דיפלומט,,שמפו וקונדישנר 2ב1 למניעת קשקשים מנטול,,0.00,100.00,false,1.00,26.90,0.00,true,0,
4015600807436,false,גילט דאו גל 75 מל CW פאוור בידס,דיפלומט,GB,דאודורנט ג'ל פאוור בידס Cool Wave,,0.00,100.00,false,1.00,33.90,0.00,true,0,
4015600807573,false,גילט דאו גל 75 מל PR פאוור בידס,דיפלומט,GB,דאודורנט ג'ל פאוור בידס Power Rush,,0.00,100.00,false,1.00,33.90,0.00,true,0,
4015600810849,false,גילט דאו קליר גל 70 מל פאוור ראש,דיפלומט,CZ,דאודורנט קליר ג'ל POWER RUSH,,0.00,100.00,false,1.00,22.90,0.00,true,0,
4015600969578,false,אוליי רגנריסט לומינוס אנטי אייגינג קרם,דיפלומט,PL,REGENERIST LUMINOUS אנטי אייג'ינג קרם יום,,0.00,100.00,false,1.00,139.90,0.02,true,0,
4045787068221,false,אינדולה פרוטאין קולור 1,General,,קרם צבע שיער שחור 1,,0.00,100.00,false,1.00,24.90,0.00,true,0,
4045787068238,false,אינדולה פרוטאין קולור 10,General,,קרם צבע שיער בלונד סופר בהיר 10,,0.00,100.00,false,1.00,24.90,0.00,true,0,
4045787068245,false,אינדולה פרוטאין קולור 1000,General,,קרם צבע שיער אקסטרה בלונד פנינה 1000,,0.00,100.00,false,1.00,24.90,0.00,true,0,
4045787068252,false,אינדולה פרוטאין קולור 1000.1,General,,קרם צבע שיער אקסטרה בלונד 1000.1,,0.00,100.00,false,1.00,24.90,0.00,true,0,
4045787068283,false,אינדולה פרוטאין קולור 1.1,General,,קרם צבע שיער שחור כחול 1.1,,0.00,100.00,false,1.00,24.90,0.00,true,0,
4045787068290,false,אינ.פרוטאין 3,General,,קרם צבע שיער חום שחור 3,,0.00,100.00,false,1.00,24.90,0.00,true,0,
4045787068306,false,אינדולה פרוטאין קולור 4,General,,קרם צבע שיער חום כהה 4,,0.00,100.00,false,1.00,24.90,0.00,true,0,
4045787068313,false,אינדולה פרוטאין קולור 4.37,General,,קרם צבע שיער שוקולד כהה 4.37,,0.00,100.00,false,1.00,24.90,0.00,true,0,
4045787068320,false,אינדולה פרוטאין קולור 5,General,,קרם צבע שיער חום 5,,0.00,100.00,false,1.00,24.90,0.00,true,0,
4045787068337,false,אינדולה פרוטאין קולור 5.35,General,,קרם צבע שיער אגוז 5.35,,0.00,100.00,false,1.00,24.90,0.00,true,0,
4045787068344,false,אינדולה פרוטאין קולור 5.4,General,,קרם צבע שיער ערמונים 5.4,,0.00,100.00,false,1.00,24.90,0.00,true,0,
4045787068351,false,אינדולה פרוטאין קולור 5.56,General,,קרם צבע לשיער בורדו קטיפה 5.56,,0.00,100.00,false,1.00,24.90,0.00,true,0,
4045787068368,false,אינדולה פרוטאין קולור 5.66,General,,קרם צבע שיער שזיף 5.66,,0.00,100.00,false,1.00,24.90,0.00,true,0,
4045787068375,false,אינדולה פרוטאין קולור 6,General,,קרם צבע שיער בלונד כהה 6,,0.00,100.00,false,1.00,24.90,0.00,true,0,
4045787068382,false,אינדולה פרוטאין קולור 6.03,General,,קרם צבע שיער חום זהבהב 6.03,,0.00,100.00,false,1.00,24.90,0.00,true,0,
4045787068405,false,אינדולה פרוטאין קולור 6.23,General,,קרם צבע שיער חום שקד 6.23,,0.00,100.00,false,1.00,24.90,0.00,true,0,
4045787068412,false,אינדולה פרוטאין קולור 6.37,General,,קרם צבע שיער שוקולד 6.37,,0.00,100.00,false,1.00,24.90,0.00,true,0,
4045787068429,false,אינדולה פרוטאין קולור 6.4,General,,קרם צבע לשיער אגוז ברזיל 6.4,,0.00,100.00,false,1.00,24.90,0.00,true,0,
4045787068436,false,אינדולה פרוטאין קולור 6.46,General,,קרם צבע לשיער נחושת אדומה 6.46,,0.00,100.00,false,1.00,24.90,0.00,true,0,
4045787068467,false,אינדולה פרוטאין קולור 7,General,,קרם צבע שיער בלונד בינוני 7,,0.00,100.00,false,1.00,24.90,0.00,true,0,
4045787068498,false,אינדולה פרוטאין קולור 7.3,General,,קרם צבע שיער דבש 7.3,,0.00,100.00,false,1.00,24.90,0.00,true,0,
4045787068504,false,אינדולה פרוטאין קולור 7.35,General,,קרם צבע שיער פקאן 7.35,,0.00,100.00,false,1.00,24.90,0.00,true,0,
4045787068511,false,אינדולה פרוטאין קולור 7.44,General,,קרם צבע לשיער דבש נחושתי 7.44,,0.00,100.00,false,1.00,24.90,0.00,true,0,
4045787068535,false,אינדולה פרוטאין קולור 7.66,General,,קרם צבע שיער אדום זוהר 7.66,,0.00,100.00,false,1.00,24.90,0.00,true,0,
4045787068542,false,אינדולה פרוטאין קולור 8,General,,קרם צבע שיער בלונד בהיר 8,,0.00,100.00,false,1.00,24.90,0.00,true,0,
4045787068566,false,אינדולה פרוטאין קולור 8.3,General,,קרם צבע שיער בלונד שמש 8.3,,0.00,100.00,false,1.00,24.90,0.00,true,0,
4045787068610,false,אינדולה פרוטאין קולור 9,General,,קרם צבע שיער בלונד טבעי 9,,0.00,100.00,false,1.00,24.90,0.00,true,0,
4045787068634,false,אינדולה פרוטאין קולור 9.3,General,,קרם צבע שיער בלונד חיטה 9.3,,0.00,100.00,false,1.00,24.90,0.00,true,0,
4048882682477,false,ואגיזן- קרם לחות ואגינלי 50 גרם,סמואלוב,DE,ואגיזן קרם לחות ואגינלי,,0.00,100.00,false,1.00,64.90,0.01,true,0,
4048882682545,false,ואגיזן חומצה לקטית 7 טבליות,סמואלוב,DE,חומצה לקטית,,0.00,0.00,false,1.00,64.90,0.00,true,0,
4053700288205,false,ויט קרם להסרת שיער לעור עדין,רקיט בנקיזר,,קרם להסרת שיער לעור רגיש,,0.00,0.00,false,1.00,39.90,0.39,true,0,
4053700292455,false,ויט רצועות שעווה עם תמציות צמחים,רקיט בנקיזר,,רצועות שעווה מוכנות לשימוש לעור רגיל,,0.00,0.00,false,1.00,39.90,3.32,true,0,
4056800600380,false,קולסטון 2000 8/3 בלונד קוניאק חדש,General,,קרם צבע שיער בלונד קוניאק 8/3,,0.00,100.00,false,1.00,26.90,0.00,true,0,
4056800762699,false,קולסטון נטורלס מיני קיט 7/0 בלונד בינוני,דיפלומט,DE,קרם צבע לשיער 7/0 בלונד בינוני,,0.00,0.00,false,1.00,27.90,0.00,true,0,
4056800762750,false,קולסטון נטורלס מיני קיט 6/0 בלונד כהה,דיפלומט,DE,קרם צבע לשיער 6/0 בלונד כהה,,0.00,0.00,false,1.00,27.90,0.00,true,0,
4056800762842,false,קולסטון נטורלס מיני קיט 5/0 חום בהיר,דיפלומט,DE,קרם צבע לשיער 5/0 חום בהיר,,0.00,0.00,false,1.00,27.90,0.00,true,0,
4056800762873,false,קולסטון נטורלס מיני קיט 4/0 חום בינוני,דיפלומט,DE,קרם צבע לשיער 4/0 חום בינוני,,0.00,0.00,false,1.00,27.90,0.00,true,0,
4056800762903,false,קולסטון נטורלס מיני קיט 3/0 חום כהה,דיפלומט,DE,קרם צבע לשיער 3/0 חום כהה,,0.00,0.00,false,1.00,27.90,0.00,true,0,
4056800762934,false,קולסטון נטורלס מיני קיט 2/0 שחור,דיפלומט,DE,קרם צבע לשיער 2/0 שחור,,0.00,0.00,false,1.00,27.90,0.00,true,0,
